{
  "name": "openssl",
  "version": "3.2.0",
  "arch": "x86_64",
  "description": "Cryptography and SSL/TLS Toolkit",
  "long_description": "The OpenSSL Project is a collaborative effort to develop a robust, commercial-grade, full-featured, and Open Source toolkit implementing the Secure Sockets Layer (SSL) and Transport Layer Security (TLS) protocols.",
  "homepage": "https://www.openssl.org/",
  "license": "Apache-2.0",
  "maintainer": "Kimigayo OS Team <team@kimigayo.org>",
  "category": "security",
  "depends": ["zlib>=1.2"],
  "makedepends": ["musl", "gcc", "perl", "zlib-dev"],
  "provides": ["openssl", "libssl", "libcrypto"],
  "conflicts": [],
  "replaces": [],
  "size": 2097152,
  "installed_size": 8388608,
  "checksum": {
    "sha256": "2222222222222222222222222222222222222222222222222222222222222222"
  },
  "signature": {
    "algorithm": "ed25519",
    "public_key": "placeholder_public_key",
    "signature": "placeholder_signature"
  },
  "build_date": "2025-01-01T00:00:00Z",
  "files": [
    "/usr/bin/openssl",
    "/usr/lib/libssl.so.3",
    "/usr/lib/libcrypto.so.3",
    "/usr/include/openssl/ssl.h",
    "/usr/share/doc/openssl/README.md"
  ],
  "source": {
    "url": "https://github.com/openssl/openssl",
    "commit": "openssl-3.2.0"
  }
}
