{
  "name": "hello-world",
  "version": "1.0.0",
  "arch": "x86_64",
  "description": "Simple hello world program for testing package system",
  "long_description": "A minimal hello world program written in C, statically linked with musl libc. Used for testing the Kimigayo OS package management system.",
  "homepage": "https://github.com/Kazuki-0731/Kimigayo",
  "license": "MIT",
  "maintainer": "Kimigayo OS Team <team@kimigayo.org>",
  "category": "utils",
  "depends": [],
  "makedepends": ["musl", "gcc"],
  "provides": ["hello"],
  "conflicts": [],
  "replaces": [],
  "size": 4096,
  "installed_size": 8192,
  "checksum": {
    "sha256": "0000000000000000000000000000000000000000000000000000000000000000"
  },
  "signature": {
    "algorithm": "ed25519",
    "public_key": "placeholder_public_key",
    "signature": "placeholder_signature"
  },
  "build_date": "2025-01-01T00:00:00Z",
  "files": [
    "/usr/bin/hello",
    "/usr/share/doc/hello-world/README.md"
  ],
  "source": {
    "url": "https://github.com/Kazuki-0731/Kimigayo",
    "commit": "main"
  }
}
